{
  "$schema": "https://unpkg.com/depgate/schema.json",
  "version": 1,
  "cooldown": {
    "minimum": "3d",
    "exclude": [],
    "securityUpdates": "bypass"
  },
  "installScripts": {
    "default": "deny",
    "allow": []
  },
  "sources": {
    "git": "deny",
    "remoteTarball": "deny",
    "file": "allow",
    "directory": "allow"
  },
  "targets": "auto"
}
